{
  "schema_version": 1,
  "adapter_id": "codex",
  "object_id": "vibesec.agent-adapter.codex.v1",
  "kind": "agent-guidance",
  "version": "1.0.0",
  "display_name": "OpenAI Codex",
  "contract_id": "vibesec.agent-guidance.v1",
  "human_documentation": "docs/agent-adapters.md",
  "output_path": "AGENTS.md",
  "instruction_convention": "Codex reads one AGENTS.override.md or AGENTS.md per directory from repository root toward the working directory; nearer files override earlier guidance.",
  "official_documentation": "https://learn.chatgpt.com/docs/agent-configuration/agents-md",
  "verified_on": "2026-07-24",
  "supports_imports": false,
  "supported_platforms": ["portable"],
  "render_sections": ["identity", "authority", "actions", "safety", "capabilities", "validation", "tasks"]
}
